[
  {
    "category": "CPU",
    "manufacturer": "Intel",
    "family": "Core",
    "series": "Core",
    "generation": "14th Generation",
    "architecture": "Raptor Lake Refresh",
    "source": {
      "name": "Intel ARK",
      "url": "https://www.intel.com/content/www/us/en/products/sku/236773/intel-core-i914900k-processor-36m-cache-up-to-6-00-ghz/specifications.html",
      "date": "2023-10-17",
      "notes": "Intel product specification page"
    },
    "product": {
      "name": "Intel Core i9-14900K",
      "slug": "intel-core-i9-14900k",
      "description": "14th Gen Intel Core desktop processor.",
      "release_date": "2023-10-17",
      "status": "active",
      "is_popular": true,
      "architecture": "Raptor Lake Refresh"
    },
    "images": [],
    "specifications": [
      { "group": "Socket", "key": "socket", "value": "LGA 1700" },
      { "group": "General", "key": "architecture", "value": "Raptor Lake Refresh" },
      { "group": "Core Configuration", "key": "cores", "value": "24" },
      { "group": "Core Configuration", "key": "threads", "value": "32" },
      { "group": "Clock Speeds", "key": "boost_clock", "value": "6.0", "unit": "GHz" },
      { "group": "Power", "key": "tdp", "value": "125", "unit": "W" }
    ],
    "benchmarks": []
  },
  {
    "category": "CPU",
    "manufacturer": "Intel",
    "family": "Core",
    "series": "Core",
    "generation": "14th Generation",
    "architecture": "Raptor Lake Refresh",
    "source": {
      "name": "Intel ARK",
      "url": "https://www.intel.com/content/www/us/en/products/sku/236783/intel-core-i714700k-processor-33m-cache-up-to-5-60-ghz/specifications.html",
      "date": "2023-10-17",
      "notes": "Intel product specification page"
    },
    "product": {
      "name": "Intel Core i7-14700K",
      "slug": "intel-core-i7-14700k",
      "description": "14th Gen Intel Core desktop processor.",
      "release_date": "2023-10-17",
      "status": "active",
      "is_popular": true,
      "architecture": "Raptor Lake Refresh"
    },
    "images": [],
    "specifications": [
      { "group": "Socket", "key": "socket", "value": "LGA 1700" },
      { "group": "Core Configuration", "key": "cores", "value": "20" },
      { "group": "Core Configuration", "key": "threads", "value": "28" },
      { "group": "Power", "key": "tdp", "value": "125", "unit": "W" }
    ],
    "benchmarks": []
  }
]
