[
  {
    "category": "CPU",
    "manufacturer": "AMD",
    "family": "Ryzen",
    "series": "Ryzen",
    "generation": "Ryzen 7000",
    "architecture": "Zen 4",
    "source": {
      "name": "AMD official product specifications",
      "url": "https://www.amd.com/en/products/processors/desktops/ryzen/7000-series/amd-ryzen-7-7800x3d.html",
      "date": "2023-04-06",
      "notes": "AMD desktop processor product page"
    },
    "product": {
      "name": "AMD Ryzen 7 7800X3D",
      "slug": "amd-ryzen-7-7800x3d",
      "description": "8-core desktop processor with AMD 3D V-Cache technology.",
      "release_date": "2023-04-06",
      "status": "active",
      "is_popular": true,
      "architecture": "Zen 4"
    },
    "images": [],
    "specifications": [
      { "group": "Socket", "key": "socket", "value": "AM5" },
      { "group": "General", "key": "architecture", "value": "Zen 4" },
      { "group": "Core Configuration", "key": "cores", "value": "8" },
      { "group": "Core Configuration", "key": "threads", "value": "16" },
      { "group": "Cache", "key": "l3_cache", "value": "96", "unit": "MB" },
      { "group": "Cache", "key": "v_cache", "value": "64", "unit": "MB" },
      { "group": "Power", "key": "tdp", "value": "120", "unit": "W" }
    ],
    "benchmarks": []
  },
  {
    "category": "CPU",
    "manufacturer": "AMD",
    "family": "Ryzen",
    "series": "Ryzen",
    "generation": "Ryzen 9000",
    "architecture": "Zen 5",
    "source": {
      "name": "AMD official product specifications",
      "url": "https://www.amd.com/en/products/processors/desktops/ryzen/9000-series/amd-ryzen-9-9950x.html",
      "date": "2024-08-15",
      "notes": "AMD desktop processor product page"
    },
    "product": {
      "name": "AMD Ryzen 9 9950X",
      "slug": "amd-ryzen-9-9950x",
      "description": "16-core desktop processor based on the Zen 5 architecture.",
      "release_date": "2024-08-15",
      "status": "active",
      "is_popular": true,
      "architecture": "Zen 5"
    },
    "images": [],
    "specifications": [
      { "group": "Socket", "key": "socket", "value": "AM5" },
      { "group": "General", "key": "architecture", "value": "Zen 5" },
      { "group": "Core Configuration", "key": "cores", "value": "16" },
      { "group": "Core Configuration", "key": "threads", "value": "32" },
      { "group": "Power", "key": "tdp", "value": "170", "unit": "W" }
    ],
    "benchmarks": []
  }
]
